[
  {"term_uid":"","zh_term":"折叠纸盒","en_term":"Folding Carton","volume_code":"V23","category":"包装结构与容器 / 折叠盒","definition_long":"折叠纸盒是以单张纸板经模切折痕粘合成型的轻便包装盒，可平铺运输现场撑开，是日用化妆品食品主流包装形式。","visual_effect":"单张模切、平铺运输、现场撑开。","prompt_usage":"用于单张纸板模切折叠成型的轻便纸盒包装结构。","use_cases":["包装","折叠盒"],"related_terms":["硬质盒"],"tags":["折叠","纸板","模切"],"status":"published","version":"V1.0"},
  {"term_uid":"","zh_term":"硬质盒","en_term":"Rigid Box","volume_code":"V23","category":"包装结构与容器 / 硬质盒","definition_long":"硬质盒是以厚硬纸板粘合成型不可折叠的厚重包装盒，质感高级、易碎品防护好，常作奢侈品电子与礼盒包装。","visual_effect":"厚重不可折、高级防护、奢侈品用。","prompt_usage":"用于厚重不可折叠的奢侈品与礼盒硬质包装盒。","use_cases":["包装","硬质盒"],"related_terms":["折叠纸盒"],"tags":["硬盒","厚重","礼盒"],"status":"published","version":"V1.0"},
  {"term_uid":"","zh_term":"软管包装","en_term":"Tube Packaging","volume_code":"V23","category":"包装结构与容器 / 软管","definition_long":"软管包装是以可挤压塑料或铝管装载膏状内容物的容器，需考虑头部口径与尾部封尾压纹，是日化化妆品药品常用容器。","visual_effect":"可挤膏体、头部口径、尾部压纹。","prompt_usage":"用于可挤压膏状内容物的软管容器包装结构。","use_cases":["包装","软管"],"tags":["软管","膏体","日化"],"status":"published","version":"V1.0"},
  {"term_uid":"","zh_term":"玻璃瓶","en_term":"Glass Bottle","volume_code":"V23","category":"包装结构与容器 / 玻璃瓶","definition_long":"玻璃瓶是以玻璃为材的密封容器，化学稳定可回收、质感高级透光可染色，是酒类香水与高端饮料首选容器。","visual_effect":"化学稳定、透光可染、高级可回。","prompt_usage":"用于玻璃材质可染色透光的高级密封容器包装。","use_cases":["包装","玻璃瓶"],"tags":["玻璃","密封","酒类"],"status":"published","version":"V1.0"},
  {"term_uid":"","zh_term":"马口铁罐","en_term":"Tin Can","volume_code":"V23","category":"包装结构与容器 / 金属罐","definition_long":"马口铁罐以镀锡铁皮制罐身加底盖的金属容器，防潮避光密封强、印刷可精、是茶叶奶粉与复古食品的经典包装。","visual_effect":"镀锡铁皮、防潮避光、复古经典。","prompt_usage":"用于镀锡铁皮防潮避光的茶叶奶粉复古金属罐包装。","use_cases":["包装","金属罐"],"tags":["马口铁","罐","复古"],"status":"published","version":"V1.0"},
  {"term_uid":"","zh_term":"吸塑泡罩","en_term":"Blister Pack","volume_code":"V23","category":"包装结构与容器 / 吸塑泡罩","definition_long":"吸塑泡罩以塑料泡罩加热封纸卡icap产品可见又防拆的包装形式，常作五金小件药品与电池的防盗陈列包装。","visual_effect":"泡罩塑卡、可见防拆、陈列防盗。","prompt_usage":"用于可见又防拆的泡罩加热封纸卡陈列包装结构。","use_cases":["包装","吸塑"],"tags":["吸塑","泡罩","防盗"],"status":"published","version":"V1.0"},
  {"term_uid":"","zh_term":"UV印刷","en_term":"UV Printing","volume_code":"V23","category":"材质与工艺 / UV工艺","definition_long":"UV印刷是以紫外线固化油墨的印刷工艺，干燥快光泽高可在塑料金属玻璃等非吸收材质直接印刷，是包装特殊材质高光印刷主流。","visual_effect":"紫外固化、高光快干、非吸收材质。","prompt_usage":"用于紫外固化高光在非吸收材质印刷的UV印刷工艺。","use_cases":["工艺","UV"],"tags":["UV","固化","高光"],"status":"published","version":"V1.0"},
  {"term_uid":"","zh_term":"烫金工艺","en_term":"Hot Foil Stamping","volume_code":"V23","category":"材质与工艺 / 烫印","definition_long":"烫金工艺以热压金属箔转印到承印物表面的高档装饰工艺，金箔银箔镭射箔可印在纸塑皮革，是奢侈品包装标志装饰。","visual_effect":"热压金属箔、高档装饰、多材可印。","prompt_usage":"用于热压金属箔转印到多材质的高档包装烫金工艺。","use_cases":["工艺","烫金"],"tags":["烫金","金属箔","高档"],"status":"published","version":"V1.0"},
  {"term_uid":"","zh_term":"击凸工艺","en_term":"Embossing","volume_code":"V23","category":"材质与工艺 / 击凸","definition_long":"击凸工艺以模具在纸板表面压出立体凹凸纹理的装饰工艺，无油墨仅靠光影立体感，是高端酒标与礼盒低调奢华装饰。","visual_effect":"模具压凹凸、无墨立体、光影装饰。","prompt_usage":"用于模具压出立体凹凸纹理的高端纸包装击凸工艺。","use_cases":["工艺","击凸"],"tags":["击凸","立体","装饰"],"status":"published","version":"V1.0"},
  {"term_uid":"","zh_term":"覆膜工艺","en_term":"Lamination","volume_code":"V23","category":"材质与工艺 / 覆膜","definition_long":"覆膜工艺以透明薄膜热压覆于印刷品表面增加光泽与防护的工艺，分光膜哑膜镭射膜，是包装盒封面防潮耐磨主流。","visual_effect":"薄膜热压、光哑镭射、防潮耐磨。","prompt_usage":"用于透明薄膜覆于印刷品增光防护的覆膜工艺。","use_cases":["工艺","覆膜"],"tags":["覆膜","防潮","光哑"],"status":"published","version":"V1.0"},
  {"term_uid":"","zh_term":"模切压痕","en_term":"Die Cutting","volume_code":"V23","category":"材质与工艺 / 模切","definition_long":"模切压痕以钢刀钢线在纸板上切出外轮廓并压出折痕的工艺，决定折叠盒形状与折角精准度，是纸包装成型核心工艺。","visual_effect":"钢刀切外廓、钢线压折痕、精准成型。","prompt_usage":"用于钢刀钢线在纸板切外廓压折痕的模切成型工艺。","use_cases":["工艺","模切"],"tags":["模切","折痕","成型"],"status":"published","version":"V1.0"},
  {"term_uid":"","zh_term":"局部UV","en_term":"Spot UV","volume_code":"V23","category":"材质与工艺 / 局部UV","definition_long":"局部UV是在印刷指定区域上UV光油制造高光对比的装饰工艺，与哑面形成质感反差，是高端名片与包装低调亮点的细节。","visual_effect":"指定高光、哑面反差、低调亮点。","prompt_usage":"用于印刷指定区域上UV光油制造高光反差的局部UV工艺。","use_cases":["工艺","局部UV"],"tags":["局部UV","反差","细节"],"status":"published","version":"V1.0"},
  {"term_uid":"","zh_term":"CMF设计","en_term":"CMF Design","volume_code":"V23","category":"产品造型与CMF / CMF","definition_long":"CMF设计是产品色彩材质表面处理的统一规划，三者协同决定产品的视觉触觉与品质感知，是工业设计后期落地关键。","visual_effect":"色材治三协、视触感知、落地关键。","prompt_usage":"用于产品色彩材质表面处理三协统一的CMF规划。","use_cases":["产品","CMF"],"tags":["CMF","色材治","规划"],"status":"published","version":"V1.0"},
  {"term_uid":"","zh_term":"注塑工艺","en_term":"Injection Molding","volume_code":"V23","category":"产品造型与CMF / 注塑","definition_long":"注塑工艺以熔融塑料高压注入金属模具冷却成型的批量生产工艺，是塑料制品成本最低产能最高、需可脱模壁厚均匀。","visual_effect":"熔塑注入、冷却脱模、壁厚均匀。","prompt_usage":"用于熔融塑料注入模具冷却成型的批量注塑工艺规定。","use_cases":["产品","注塑"],"tags":["注塑","塑料","量产"],"status":"published","version":"V1.0"},
  {"term_uid":"","zh_term":"阳极氧化铝","en_term":"Anodized Aluminum","volume_code":"V23","category":"产品造型与CMF / 阳极氧化","definition_long":"阳极氧化铝是以电化学在铝表面生成硬质氧化膜的CMF工艺，硬度高染色可控质感细腻，是苹果产品与高端电子首选 CMF。","visual_effect":"电化学膜、染色可控、质感细腻。","prompt_usage":"用于电化学在铝表面生成染色硬质膜的CMF阳极氧化工艺。","use_cases":["产品","阳极氧化"],"tags":["阳极氧化","铝","CMF"],"status":"published","version":"V1.0"},
  {"term_uid":"","zh_term":"CNC切削","en_term":"CNC Machining","volume_code":"V23","category":"产品造型与CMF / CNC","definition_long":"CNC切削以数控机床从金属坯料切出产品结构的精密加工工艺，精度高质感好、是高端金属机身与原型样机的成型首选。","visual_effect":"数控切削、精度高质感好、金属成型。","prompt_usage":"用于数控机床从金属坯料精密切出结构的CNC工艺。","use_cases":["产品","CNC"],"tags":["CNC","切削","金属"],"status":"published","version":"V1.0"},
  {"term_uid":"","zh_term":"样机mockup","en_term":"Mockup","volume_code":"V23","category":"样机与mockup / 样机","definition_long":"样机mockup是以模型或渲染模拟产品最终落地效果的预览场景，含空白产品图与PSD模板套图，是设计提案视觉化关键。","visual_effect":"落地预览、空白套图、提案视觉化。","prompt_usage":"用于模拟产品最终落地效果的样机mockup预览场景。","use_cases":["样机","mockup"],"tags":["mockup","样机","预览"],"status":"published","version":"V1.0"},
  {"term_uid":"","zh_term":"场景化mockup","en_term":"Scene Mockup","volume_code":"V23","category":"样机与mockup / 场景mockup","definition_long":"场景化mockup 把产品植入真实或虚拟使用环境中的样机形式，比纯白底mockup更传达使用情境与情感氛围，是提案高阶形式。","visual_effect":"使用场景、情境情感、提案高阶。","prompt_usage":"用于产品植入使用场景传达情境的场景化mockup。","use_cases":["样机","场景"],"tags":["场景","mockup","提案"],"status":"published","version":"V1.0"},
  {"term_uid":"","zh_term":"人因工学","en_term":"Ergonomics","volume_code":"V23","category":"人因与功能形态 / 人因","definition_long":"人因工学是按人体测量与运动生理设计产品形态与尺寸的设计原则，确保握持操作长期使用舒适安全，是工业设计根基。","visual_effect":"人体测量、握持舒适、长期安全。","prompt_usage":"用于按人体测量与运动生理设计产品形态的人因工学要素。","use_cases":["人因","工业设计"],"tags":["人因","测量","握持"],"status":"published","version":"V1.0"},
  {"term_uid":"","zh_term":"握持曲线","en_term":"Grip Curve","volume_code":"V23","category":"人因与功能形态 / 握持","definition_long":"握持曲线是产品握把与手部接触的曲面设计，按手部解剖与受力分析优化弧度与材质，是手机鼠标工具手柄舒适度核心。","visual_effect":"解剖弧度、受力分布、握持舒适。","prompt_usage":"用于按手部解剖优化弧度与材质的握持曲线设计。","use_cases":["人因","握持"],"tags":["握持","解剖","曲线"],"status":"published","version":"V1.0"}
]