[
  {"term_uid":"","zh_term":"文字标识","en_term":"Wordmark","volume_code":"V22","category":"标志与字标 / 文字标","definition_long":"文字标识是仅以品牌名定制化字体呈现的标识形式，无附属图形、依赖字型笔画与字间距塑造识别度，常见可口可乐Google。","visual_effect":"纯字定制、无附属图形、字型识别。","prompt_usage":"用于仅以品牌定制字型呈现识别的文字标识设计。","use_cases":["标志","字标"],"related_terms":["字母标识"],"confused_with":["字母标识"],"tags":["wordmark","字型","识别"],"status":"published","version":"V1.0"},
  {"term_uid":"","zh_term":"字母标识","en_term":"Lettermark","volume_code":"V22","category":"标志与字标 / 字母标","definition_long":"字母标识以品牌首字母缩写呈现的标识形式，常用于冗长机构名简化（IBM、NASA），需定制字型与识别度统一整体调性。","visual_effect":"缩写字型、机构简化、定制统一。","prompt_usage":"用于品牌首字母缩写定制的字母标识设计。","use_cases":["标志","字标"],"related_terms":["文字标识"],"tags":["字母标","缩写","机构"],"status":"published","version":"V1.0"},
  {"term_uid":"","zh_term":"图形标志","en_term":"Brandmark / Pictorial Mark","volume_code":"V22","category":"标志与字标 / 图形标","definition_long":"图形标志是纯图形无文字的品牌标识，依赖具象或抽象图形传达品牌精神（如苹果被咬苹果、Nike勾），国际通用无语言障碍。","visual_effect":"纯图形无线字、国际通用、精神象征。","prompt_usage":"用于纯图形无文字传达品牌精神的图形标志。","use_cases":["标志","图形标"],"related_terms":["抽象标志"],"tags":["图形标","象征","国际"],"status":"published","version":"V1.0"},
  {"term_uid":"","zh_term":"抽象标志","en_term":"Abstract Mark","volume_code":"V22","category":"标志与字标 / 抽象标","definition_long":"抽象标志是非具象几何形构成的图形标志，借形与色传达品牌理念（Pepsi圆、 Mitsubishi三菱），无具体物但识别度强易注册。","visual_effect":"抽象几何、理念传达、易注册。","prompt_usage":"用于非具象几何形传达理念易注册的抽象标志。","use_cases":["标志","抽象标"],"related_terms":["图形标志"],"tags":["抽象标","几何","注册"],"status":"published","version":"V1.0"},
  {"term_uid":"","zh_term":"组合标志","en_term":"Combination Mark","volume_code":"V22","category":"标志与字标 / 组合标","definition_long":"组合标志是图形与文字标识组合于一体的标志形式，可整体可拆分使用，灵活性最强是商用最主流的标识形式。","visual_effect":"图文组合、可拆分用、主流商用。","prompt_usage":"用于图形与文字可整体可拆分使用的组合标志。","use_cases":["标志","组合标"],"tags":["组合标","图文","主流"],"status":"published","version":"V1.0"},
  {"term_uid":"","zh_term":"徽章标志","en_term":"Emblem","volume_code":"V22","category":"标志与字标 / 徽章标","definition_long":"徽章标志是文字嵌入图形内部的封闭式标识形式，传统感强、官方调性，常见政府机构大学与咖啡品牌Starbucks。","visual_effect":"文字嵌图、封闭传统、官方调性。","prompt_usage":"用于文字嵌入图形的传统官方徽章式标识。","use_cases":["标志","徽章"],"tags":["徽章","封闭","传统"],"status":"published","version":"V1.0"},
  {"term_uid":"","zh_term":"动态标志","en_term":"Dynamic Logo","volume_code":"V22","category":"标志与字标 / 动态标","definition_long":"动态标志是可在不同场景自适应变形的活体标识系统，保留识别核心但形色可变，常见数字品牌与媒体网络频道。","visual_effect":"自适应变形、核心不变、数字品牌。","prompt_usage":"用于不同场景自适应变形的活体动态标志系统。","use_cases":["标志","动态"],"tags":["动态","自适应","数字"],"status":"published","version":"V1.0"},
  {"term_uid":"","zh_term":"吉祥物标志","en_term":"Mascot Logo","volume_code":"V22","category":"标志与字标 / 吉祥标","definition_long":"吉祥物标志以拟人化角色为品牌代言的标识形式，亲和力强适合家庭体育与食品品牌，是品牌人格化的具象表达载体。","visual_effect":"拟人代言、亲和人格、家庭体育。","prompt_usage":"用于拟人化角色代言品牌的吉祥物标志设计。","use_cases":["标志","吉祥标"],"tags":["吉祥标","拟人","代言"],"status":"published","version":"V1.0"},
  {"term_uid":"","zh_term":"应用图标","en_term":"App Icon","volume_code":"V22","category":"图标系统 / 应用图标","definition_long":"应用图标是手机桌面与商店展示的应用程序标识图标，需在小尺寸高辨识、圆角适配各平台规范、隐喻功能用途。","visual_effect":"小尺寸高辨、圆角适配、功能隐喻。","prompt_usage":"用于手机桌面与商店高辨识圆角适配的应用图标。","use_cases":["图标","应用"],"tags":["app图标","圆角","高辨"],"status":"published","version":"V1.0"},
  {"term_uid":"","zh_term":"系统图标","en_term":"System Icon","volume_code":"V22","category":"图标系统 / 系统图标","definition_long":"系统图标是界面操作的功能性小图标（保存返回删除），需统一笔画粗细、网格对齐、含义明确，是设计系统的骨架组成。","visual_effect":"笔画统一、网格对齐、含义明确。","prompt_usage":"用于设计系统统一笔画与网格对齐的功能图标。","use_cases":["图标","系统"],"tags":["系统图标","笔画","网格"],"status":"published","version":"V1.0"},
  {"term_uid":"","zh_term":"线性图标","en_term":"Outline Icon","volume_code":"V22","category":"图标系统 / 线性图标","definition_long":"线性图标以纯线条勾勒无填充的图标形式，轻量简洁适配现代扁平UI，需统一线粗与端点圆角，轻快但对比度弱。","visual_effect":"纯线无填、轻量现代、统一线粗。","prompt_usage":"用于统一线粗与端点圆角的轻量线性图标。","use_cases":["图标","线性"],"tags":["线性","outline","轻量"],"status":"published","version":"V1.0"},
  {"term_uid":"","zh_term":"填充图标","en_term":"Solid Icon","volume_code":"V22","category":"图标系统 / 填充图标","definition_long":"填充图标以纯色块填充为底的图标形式，对比强识别度高，适合小尺寸与深色背景，是 Material Design 主流。","visual_effect":"色块填充、对比强、小尺寸识别。","prompt_usage":"用于色块填充对比强的小尺寸高识别图标。","use_cases":["图标","填充"],"tags":["填充","solid","对比"],"status":"published","version":"V1.0"},
  {"term_uid":"","zh_term":"双色图标","en_term":"Duotone Icon","volume_code":"V22","category":"图标系统 / 双色图标","definition_long":"双色图标以两种颜色（主色+辅色）组合的图标形式，常以主色填外形辅色填内部细节，比单色更立体但仍简洁。","visual_effect":"主辅双色、主外辅内、立体简洁。","prompt_usage":"用于主辅双色组合的立体简洁图标设计。","use_cases":["图标","双色"],"tags":["双色","duotone","立体"],"status":"published","version":"V1.0"},
  {"term_uid":"","zh_term":"栅格图标","en_term":"Grid Icon","volume_code":"V22","category":"栅格与造型规范 / 图标栅格","definition_long":"栅格图标是按等距栅格与笔画规范绘制的图标系统，保证多个图标视觉重量与对齐一致，是 Material 与 iOS 图标规范核心。","visual_effect":"等距栅格、笔画规范、视觉一致。","prompt_usage":"用于按栅格与笔画规范保证视觉一致的图标系统。","use_cases":["图标","栅格"],"tags":["栅格","规范","一致"],"status":"published","version":"V1.0"},
  {"term_uid":"","zh_term":"像素栅格","en_term":"Pixel Grid","volume_code":"V22","category":"栅格与造型规范 / 像素栅格","definition_long":"像素栅格是按像素整数对齐绘制图标以保证小尺寸锐利不糊的栅格法，每一笔落整像素、避免抗锯齿模糊、是App图标必备规范。","visual_effect":"像素对齐、整像素落笔、小尺寸锐利。","prompt_usage":"用于整像素对齐保证小尺寸锐利的App图标栅格。","use_cases":["图标","像素栅格"],"tags":["像素栅格","对齐","锐利"],"status":"published","version":"V1.0"},
  {"term_uid":"","zh_term":"象形符号","en_term":"Pictogram","volume_code":"V22","category":"象形与符号 / 象形符号","definition_long":"象形符号是以简化图形表达实物含义的通用符号（洗手间男女等），无需文字跨语言可读，是公共导视与国际标准核心。","visual_effect":"简化图形、跨语言可读、公共导视。","prompt_usage":"用于跨语言可读的公共导视简化象形符号。","use_cases":["符号","象形"],"tags":["象形","公共","导视"],"status":"published","version":"V1.0"},
  {"term_uid":"","zh_term":"交通符号","en_term":"Traffic Symbol","volume_code":"V22","category":"象形与符号 / 交通符号","definition_long":"交通符号是道路标识的标准化象形符号系统，需高对比全天候可读距离远，受国家交通法规约束定型不可自由发挥。","visual_effect":"高对比法规、全天候可读、距离远。","prompt_usage":"用于道路标识标准化高对比的交通象形符号。","use_cases":["符号","交通"],"tags":["交通","法规","标准"],"status":"published","version":"V1.0"},
  {"term_uid":"","zh_term":"VI系统","en_term":"Visual Identity System","volume_code":"V22","category":"品牌标识应用 / VI系统","definition_long":"VI系统是企业视觉识别的整套规范体系，含标志、字体、色板、辅助图形与应用守则，确保跨媒介跨场景品牌调性统一。","visual_effect":"整套规范、跨媒介统一、调性约束。","prompt_usage":"用于企业跨媒介跨场景统一调性的VI视觉识别系统。","use_cases":["品牌","VI"],"tags":["VI","规范","识别"],"status":"published","version":"V1.0"},
  {"term_uid":"","zh_term":"品牌色板","en_term":"Brand Color Palette","volume_code":"V22","category":"品牌标识应用 / 品牌色","definition_long":"品牌色板是VI中规定品牌主辅与中性色的色板规范，含RGB/CMYK/HEX多色彩空间值与使用比例，约束品牌调色统一性。","visual_effect":"主辅中性色、多空间值、使用比例。","prompt_usage":"用于规定品牌主辅中性色与多空间值的品牌色板规范。","use_cases":["品牌","色板"],"tags":["色板","VI","规范"],"status":"published","version":"V1.0"},
  {"term_uid":"","zh_term":"辅助图形","en_term":"Supporting Graphic","volume_code":"V22","category":"品牌标识应用 / 辅助图形","definition_long":"辅助图形是VI中配合标志使用的延展图形系统，源自标志基因或几何规律扩展，负责填充版面与延展品牌识别到不同媒介。","visual_effect":"标志延展、填版延展、基因扩展。","prompt_usage":"用于配合标志延展识别到不同媒介的辅助图形系统。","use_cases":["品牌","辅助图形"],"tags":["辅助图形","延展","VI"],"status":"published","version":"V1.0"}
]