[
  {"term_uid":"","zh_term":"标签贴纸","en_term":"Label Sticker","volume_code":"V23","category":"包装结构与容器 / 标签","definition_long":"标签贴纸是置于容器或产品上传达信息的纸质或薄膜小贴附，含成分条码价格与品牌，是包装信息层最灵活载体。","visual_effect":"小贴载信、信息层活、成分条码。","prompt_usage":"用于容器产品上传达成分条码信息的标签贴纸。","use_cases":["包装","标签"],"tags":["标签","贴纸","信息"],"status":"published","version":"V1.0"},
  {"term_uid":"","zh_term":"真空包装","en_term":"Vacuum Packaging","volume_code":"V23","category":"包装结构与容器 / 真空包装","definition_long":"真空包装是抽尽容器内空气后封口的保鲜包装形式，隔绝氧气延长保质期、贴体紧裹内容物，常见食品奶酪与医疗器械。","visual_effect":"抽空保鲜、贴体紧裹、隔氧保质。","prompt_usage":"用于抽空空气隔氧延长保质期的真空包装结构。","use_cases":["包装","真空"],"tags":["真空","保鲜","隔氧"],"status":"published","version":"V1.0"},
  {"term_uid":"","zh_term":"气调包装","en_term":"MAP Packaging","volume_code":"V23","category":"包装结构与容器 / 气调包装","definition_long":"气调包装以特定比例气体置换容器内空气延长生鲜保鲜期，比真空更温和不挤压外观，常见生鲜肉与即食沙拉包装。","visual_effect":"气体调比、生鲜保鲜、不挤压外观。","prompt_usage":"用于以特定比例气体置换保鲜生鲜的气调包装。","use_cases":["包装","气调"],"tags":["气调","MAP","保鲜"],"status":"published","version":"V1.0"},
  {"term_uid":"","zh_term":"利乐包","en_term":"Tetra Pak","volume_code":"V23","category":"包装结构与容器 / 利乐","definition_long":"利乐包是多层复合材料（纸塑铝箔）无菌灌装的液体包装盒，避光隔氧保鲜期长，是牛奶果汁与常温液体的全球主流包装。","visual_effect":"多层复合、无菌灌装、避光隔氧。","prompt_usage":"用于多层复合材料无菌灌装液体的利乐包结构。","use_cases":["包装","利乐"],"tags":["利乐","无菌","液体"],"status":"published","version":"V1.0"},
  {"term_uid":"","zh_term":"易拉罐","en_term":"Aluminum Can","volume_code":"V23","category":"包装结构与容器 / 易拉罐","definition_long":"易拉罐是以铝合金冲拉罐身加易开盖的金属饮料容器，可回收率高印刷可精，是碳酸饮料啤酒全球主流一次性包装。","visual_effect":"铝冲拉伸、易开盖封、印刷可精。","prompt_usage":"用于铝合金冲拉伸可易开盖饮料易拉罐容器。","use_cases":["包装","易拉罐"],"tags":["易拉罐","铝","饮料"],"status":"published","version":"V1.0"},
  {"term_uid":"","zh_term":"丝印工艺","en_term":"Screen Printing","volume_code":"V23","category":"材质与工艺 / 丝印","definition_long":"丝印工艺以丝网漏版刮印油墨到承印物的印刷工艺，墨层厚覆盖强可曲面印刷，是瓶身曲面与限量包装的常用工艺。","visual_effect":"丝网漏版、墨层厚覆盖、曲面可印。","prompt_usage":"用于丝网漏版刮印油墨到曲面瓶身的丝印工艺。","use_cases":["工艺","丝印"],"tags":["丝印","曲面","墨厚"],"status":"published","version":"V1.0"},
  {"term_uid":"","zh_term":"磨砂工艺","en_term":"Frosted Finish","volume_code":"V23","category":"材质与工艺 / 磨砂","definition_long":"磨砂工艺以喷砂或化学蚀刻使玻璃塑料表面形成细微颗粒失光的工艺，比光泽更柔和防指纹，是化妆品瓶与电子高端点缀。","visual_effect":"微颗粒失光、柔和防指纹、高端点缀。","prompt_usage":"用于喷砂蚀刻使表面朦胧失光的磨砂工艺。","use_cases":["工艺","磨砂"],"tags":["磨砂","失光","防指纹"],"status":"published","version":"V1.0"},
  {"term_uid":"","zh_term":"拉丝工艺","en_term":"Brushed Finish","volume_code":"V23","category":"材质与工艺 / 拉丝","definition_long":"拉丝工艺以砂带在金属表面拉出平行细纹的 CMF 处理，质感技术感强遮划痕，是不锈钢家电与电子金属面板常用质感。","visual_effect":"平行细纹、技术感、遮划痕。","prompt_usage":"用于金属表面拉出平行细纹的拉丝工艺质感处理。","use_cases":["工艺","拉丝"],"tags":["拉丝","金属","细纹"],"status":"published","version":"V1.0"},
  {"term_uid":"","zh_term":"皮革纹理","en_term":"Leather Texture","volume_code":"V23","category":"材质与工艺 / 皮革纹理","definition_long":"皮革纹理以压花或覆膜在纸塑表面复刻真皮纹理的 CMF 工艺，传达高级复古触感，常见精装盒与电子产品的仿皮外壳。","visual_effect":"真皮压纹、高级复古、纸塑仿皮。","prompt_usage":"用于压花覆膜在纸塑表面复刻真皮纹理的工艺。","use_cases":["工艺","皮革纹理"],"tags":["皮革纹理","压花","仿皮"],"status":"published","version":"V1.0"},
  {"term_uid":"","zh_term":"哑光涂层","en_term":"Matte Coating","volume_code":"V23","category":"材质与工艺 / 哑光涂层","definition_long":"哑光涂层以雾面光油在产品表面制造低反射柔光的 CMF 处理，比光泽更内敛高级遮指纹，是高端电子与化妆品主流。","visual_effect":"雾面低反、内敛高级、遮指纹。","prompt_usage":"用于雾面光油制造低反射柔光的哑光涂层处理。","use_cases":["工艺","哑光"],"tags":["哑光","雾面","高级"],"status":"published","version":"V1.0"},
  {"term_uid":"","zh_term":"塑胶模具","en_term":"Plastic Mold","volume_code":"V23","category":"产品造型与CMF / 塑胶模具","definition_long":"塑胶模具是注塑成型的金属母模钢模，决定塑件表面精度与分模线位置，是塑料制品量产的核心资产成本最高。","visual_effect":"钢模母模、分模线定、量产核心。","prompt_usage":"用于决定注塑件表面与分模线的塑胶模具钢模。","use_cases":["产品","模具"],"tags":["模具","注塑","分模"],"status":"published","version":"V1.0"},
  {"term_uid":"","zh_term":"分模线","en_term":"Parting Line","volume_code":"V23","category":"产品造型与CMF / 分模线","definition_long":"分模线是注塑产品两个模具半模接合处在塑件上留下的细线，工业设计需预测其位置藏于视觉不显眼处是品质感关键。","visual_effect":"半模接合细线、藏于不显、品质关键。","prompt_usage":"用于决定并藏匿注塑半模接合分模线的产品设计。","use_cases":["产品","分模线"],"tags":["分模线","注塑","品质"],"status":"published","version":"V1.0"},
  {"term_uid":"","zh_term":"产品语义","en_term":"Product Semantics","volume_code":"V23","category":"人因与功能形态 / 产品语义","definition_long":"产品语义是通过造型语言传达产品功能与操作方式的设计理论，让形态本身提示用户怎么用，是工业设计的高阶素养。","visual_effect":"形态提示、操作自明、高阶素养。","prompt_usage":"用于以造型语言传达产品功能与操作方式的产品语义设计。","use_cases":["人因","产品语义"],"tags":["产品语义","造型","自明"],"status":"published","version":"V1.0"},
  {"term_uid":"","zh_term":"极简工业风","en_term":"Minimalist Industrial","volume_code":"V23","category":"人因与功能形态 / 极简工业","definition_long":"极简工业风是工业设计减少多余装饰突出材质与功能极简风，借鉴德意志制造联盟与包豪斯传统，是北欧美学根基。","visual_effect":"无多余装饰、材与功能突出、欧美根基。","prompt_usage":"用于减少装饰突出材与功能的极简工业风产品造型。","use_cases":["人因","极简"],"tags":["极简","包豪斯","工业风"],"status":"published","version":"V1.0"},
  {"term_uid":"","zh_term":"情感化设计","en_term":"Emotional Design","volume_code":"V23","category":"人因与功能形态 / 情感化","definition_long":"情感化设计是通过造型材质细节唤起用户情感共鸣的设计理论，借本能行为反思三层级建立产品与人的情感联结。","visual_effect":"情感共鸣、三层唤起、人产品联结。","prompt_usage":"用于唤起用户三层情感共鸣的情感化产品设计。","use_cases":["人因","情感化"],"tags":["情感化","共鸣","三层"],"status":"published","version":"V1.0"},
  {"term_uid":"","zh_term":"系列化包装","en_term":"Series Packaging","volume_code":"V23","category":"包装结构与容器 / 系列化","definition_long":"系列化包装是同一品牌多 SKU 在视觉系统下的差异化标识设计，主识别统一辅助图形按口味规格区分，强化货架识别。","visual_effect":"视觉系统化、主统一辅分、货架识别。","prompt_usage":"用于同品牌多SKU统一系统下差异化货架识别的系列化包装。","use_cases":["包装","系列化"],"tags":["系列化","SKU","货架"],"status":"published","version":"V1.0"},
  {"term_uid":"","zh_term":"礼盒套装","en_term":"Gift Set Box","volume_code":"V23","category":"包装结构与容器 / 礼盒","definition_long":"礼盒套装是节庆与赠礼场景的多件组合包装形式，含内托固定件与高端外盒，需考虑陈列抽屉质感与开箱仪式感。","visual_effect":"多件组合、内托固定、开箱仪式。","prompt_usage":"用于节庆赠礼多件组合带内托与开箱仪式的礼盒包装。","use_cases":["包装","礼盒"],"tags":["礼盒","组合","仪式"],"status":"published","version":"V1.0"},
  {"term_uid":"","zh_term":"电商专用包装","en_term":"E-commerce Packaging","volume_code":"V23","category":"包装结构与容器 / 电商包装","definition_long":"电商专用包装针对快递运输设计的加固防摔包装形式，需抗压缓冲防盗拆，是电商品牌降低破损率与开箱体验平衡。","visual_effect":"抗压缓冲、防摔防盗、开箱体验。","prompt_usage":"用于快递运输设计的抗压防摔电商专用包装结构。","use_cases":["包装","电商"],"tags":["电商","快递","抗压"],"status":"published","version":"V1.0"},
  {"term_uid":"","zh_term":"可持续包装","en_term":"Sustainable Packaging","volume_code":"V23","category":"包装结构与容器 / 可持续","definition_long":"可持续包装以可回收可降解可循环材料减少环境负担的包装形式，需平衡环保与功能成本，是品牌 ESG 与未来主流。","visual_effect":"可回收降、循环减负、ESG主流。","prompt_usage":"用于以可回收可降解材料减少环境负担的可持续包装设计。","use_cases":["包装","可持续"],"tags":["可持续","ESG","可回收"],"status":"published","version":"V1.0"},
  {"term_uid":"","zh_term":"开箱体验","en_term":"Unboxing Experience","volume_code":"V23","category":"包装结构与容器 / 开箱体验","definition_long":"开箱体验是产品从拆封到取出的全流程视觉触觉与情感设计，是品牌与用户的第一次物质接触，是品牌记忆关键触点。","visual_effect":"拆封取出、触情齐设、品牌记忆。","prompt_usage":"用于设计拆封到取出的全流程触觉情感开箱体验。","use_cases":["包装","开箱"],"tags":["开箱","体验","触点"],"status":"published","version":"V1.0"}
]