[
  {
    "zh_term": "叶片脉络图",
    "en_term": "Leaf Venation",
    "volume_code": "V26",
    "category": "植物科学绘图 / 器官解剖",
    "definition_long": "呈现叶脉羽脉或掌脉分支结构以鉴植物分类的科学绘图，叶脉序图谱典型，脉络走向清晰。",
    "visual_effect": "呈叶脉网状或平行分支展开并标主次脉的科学图样，工整细致，传递严谨而具说服力的植物分类气质。",
    "prompt_usage": "用于生成叶脉图谱或植物分类示意；主脉与支脉层级须分明以保分类科学记录意义。",
    "use_cases": ["植物分类教学", "园艺科普插图", "植物形态参考"],
    "tags": ["叶脉", "植物绘图", "分类", "脉络"],
    "status": "published",
    "version": "V1.0"
  },
  {
    "zh_term": "种子解剖图",
    "en_term": "Seed Dissection",
    "volume_code": "V26",
    "category": "植物科学绘图 / 器官解剖",
    "definition_long": "呈现种子胚乳子叶种皮纵剖结构的科学绘图，植物繁殖学教学典型，剖面标号清晰。",
    "visual_effect": "呈种子纵剖放大配子叶胚乳标号的微观图样，工整严谨，传递严密而客观的植物繁殖学气质。",
    "prompt_usage": "用于生成种子解剖或植物繁殖教学；剖面放大与器官标号须清晰以保科学准确。",
    "use_cases": ["植物繁殖教学", "种子科普插图", "农学图鉴"],
    "tags": ["种子", "解剖", "植物绘图", "繁殖"],
    "status": "published",
    "version": "V1.0"
  },
  {
    "zh_term": "苔藓放大图",
    "en_term": "Moss Magnified",
    "volume_code": "V26",
    "category": "植物科学绘图 / 整株与生态",
    "definition_long": "放大呈现苔藓孢蒴假根叶状体的微观植物绘图，苔藓志与微观植物学典型，结构清楚微缩。",
    "visual_effect": "呈苔藓孢蒴与假根放大配标号的微观图样，工整精细，传递严谨而具微观感的苔藓学记录气质。",
    "prompt_usage": "用于生成苔藓图谱或微观植物插画；放大倍率与器官标号须明确以免失微观准确。",
    "use_cases": ["苔藓志配图", "微观植物科普", "园艺参考"],
    "tags": ["苔藓", "微观", "植物绘图", "放大"],
    "status": "published",
    "version": "V1.0"
  },
  {
    "zh_term": "菌丝孢子图",
    "en_term": "Mycelium Spore",
    "volume_code": "V26",
    "category": "植物科学绘图 / 整株与生态",
    "definition_long": "放大呈现真菌菌丝与孢子囊结构的微观植物绘图，真菌志与植物病理典型，结构微观清楚。",
    "visual_effect": "呈菌丝网与孢子囊放大配标号的微观图样，结构奇异细致，传递严谨的真菌学记录气质。",
    "prompt_usage": "用于生成真菌图谱或菌物科普；菌丝走向与孢子囊结构须分明以保科学准确。",
    "use_cases": ["真菌志配图", "菌物科普插画", "植物病理参考"],
    "tags": ["菌丝", "孢子", "真菌", "微观"],
    "status": "published",
    "version": "V1.0"
  },
  {
    "zh_term": "哺乳动物解剖图",
    "en_term": "Mammal Anatomy",
    "volume_code": "V26",
    "category": "解剖与生物插画 / 脊椎动物解剖",
    "definition_long": "呈现哺乳动物骨骼肌齿等解剖结构的科学绘图，比较解剖学与自然史绘画典型，结构比对严密。",
    "visual_effect": "呈整姿配剖露骨骼肌齿的科学解剖样式，工整对照，传递严谨而具说服力的比较解剖学气质。",
    "prompt_usage": "用于生成动物解剖图或自然史插画；解剖部位朝向须统一以利比对避免散乱失序。",
    "use_cases": ["比较解剖学图", "动物科普视觉", "博物馆展陈"],
    "tags": ["哺乳动物", "解剖", "比较解剖", "自然史"],
    "status": "published",
    "version": "V1.0"
  },
  {
    "zh_term": "海葵珊瑚解剖",
    "en_term": "Coral Polyp Anatomy",
    "volume_code": "V26",
    "category": "解剖与生物插画 / 昆虫及其他无脊椎",
    "definition_long": "呈现海葵珊瑚虫触手口盘基盘剖视的科学绘图，海洋无脊椎动物志典型，结构鲜艳微观。",
    "visual_effect": "呈珊瑚虫触手与基盘剖露放大配微观标号的图样，结构奇异工整，传递严谨的海洋动物学记录气质。",
    "prompt_usage": "用于生成海洋无脊椎图鉴或科普；触手与基盘剖面须分明以保动物学科学准确。",
    "use_cases": ["海洋无脊椎图鉴", "海洋科普视觉", "珊瑚博物馆展陈"],
    "tags": ["珊瑚", "海葵", "无脊椎", "海洋"],
    "status": "published",
    "version": "V1.0"
  },
  {
    "zh_term": "果蝇染色体图",
    "en_term": "Drosophila Chromosome",
    "volume_code": "V26",
    "category": "解剖与生物插画 / 细胞与微观世界",
    "definition_long": "呈现果蝇唾腺染色体巨型条纹模式的科学绘图，遗传学教学典型，染色体带纹清晰可数。",
    "visual_effect": "呈巨型染色体横纹模式配标号的微观图样，纹理鲜明工整，传递严密而具学术性的遗传学记录气质。",
    "prompt_usage": "用于生成染色体图谱或遗传学教学；横纹模式与标号须精准以保遗传学科学准确。",
    "use_cases": ["遗传学教学图", "生物学科普", "基因学示意"],
    "tags": ["染色体", "果蝇", "遗传学", "微观"],
    "status": "published",
    "version": "V1.0"
  },
  {
    "zh_term": "DNA双螺旋图",
    "en_term": "DNA Double Helix",
    "volume_code": "V26",
    "category": "解剖与生物插画 / 细胞与微观世界",
    "definition_long": "呈现DNA双螺旋结构与碱基配对的科学示意绘图，分子生物学教学典型，结构优雅对称。",
    "visual_effect": "呈双螺旋盘绕配碱基配对的对称示意图样，造型优雅工整，传递精密而具说服力的分子生物学气质。",
    "prompt_usage": "用于生成分子生物学示意或科普；双螺旋的盘绕节律与碱基对位须严谨避免失真。",
    "use_cases": ["分子生物学教学", "基因科普视觉", "生物科技品牌"],
    "tags": ["DNA", "双螺旋", "分子生物", "示意"],
    "status": "published",
    "version": "V1.0"
  },
  {
    "zh_term": "鳞翅目彩图",
    "en_term": "Lepidoptera Plate",
    "volume_code": "V26",
    "category": "博物志风格 / 分类示意",
    "definition_long": "以多种蝴蝶蛾并排展示鳞翅目分类与色彩图案的彩绘博物志版面，玛丽亚席宾娜经典题材。",
    "visual_effect": "呈蝶蛾并排展翅配学名与底白标尺的工整彩图，色彩华丽规整，传递18世纪自然史博物气质。",
    "prompt_usage": "用于生成蝶蛾博物志或自然史插画；展翅姿态与学名排版须工整以保博物志风格永续。",
    "use_cases": ["蝶类博物志", "自然史插画", "复古科普品牌"],
    "tags": ["鳞翅目", "博物志", "蝶蛾", "玛丽亚"],
    "status": "published",
    "version": "V1.0"
  },
  {
    "zh_term": "海藻图谱",
    "en_term": "Seaweed Plate",
    "volume_code": "V26",
    "category": "博物志风格 / 博物志版面",
    "definition_long": "以多种海藻按形态布展呈分类陈列的博物志图谱，哈维海藻自然史典图典型，多色淡雅工整。",
    "visual_effect": "呈多类海藻放射排布配学名与底白的工整彩图，色素淡雅精致，传递19世纪海藻学的学术气质。",
    "prompt_usage": "用于生成海藻博物图或海洋科普；放射排布与学名排版须匀整以保传统博物志风格质感。",
    "use_cases": ["海藻博物图", "海洋科普视觉", "自然史品牌"],
    "tags": ["海藻", "博物志", "海洋", "自然史"],
    "status": "published",
    "version": "V1.0"
  },
  {
    "zh_term": "鸟卵彩图",
    "en_term": "Egg Plate",
    "volume_code": "V26",
    "category": "自然标本与化石 / 动物标本",
    "definition_long": "以多种鸟卵按比例陈列展示分类色泽的科学绘图，奥杜邦鸟类志卵谱典型，对称陈列规整。",
    "visual_effect": "呈各类鸟卵放大按比例放射并排配学名标号的工整图样，色泽工整典雅，传递鸟类学的典藏考究气质。",
    "prompt_usage": "用于生成鸟卵图谱或自然史科普；放大比例与放射排布须匀整以保留典藏学术感。",
    "use_cases": ["鸟卵博物图", "鸟类科普视觉", "自然博物馆展陈"],
    "tags": ["鸟卵", "标本", "博物志", "鸟类图"],
    "status": "published",
    "version": "V1.0"
  },
  {
    "zh_term": "矿石陈列图",
    "en_term": "Mineral Display",
    "volume_code": "V26",
    "category": "自然标本与化石 / 矿物陈列标本",
    "definition_long": "以多种矿石按类别整齐陈列展示的科学绘图，地质博物馆矿物志典型，晶形色泽工整排列。",
    "visual_effect": "呈各类矿石整齐柜藏陈列配学名与标准的工整图样，色调典雅华美，传递矿物学典藏的精严气质。",
    "prompt_usage": "用于生成矿物陈列图或地质博物馆视觉；柜藏排布与晶形朝向须匀整以保典藏学术感。",
    "use_cases": ["矿物志配图", "地质博物馆展陈", "矿物科普视觉"],
    "tags": ["矿物", "陈列", "博物馆", "地质"],
    "status": "published",
    "version": "V1.0"
  },
  {
    "zh_term": "恐龙复原图",
    "en_term": "Dinosaur Restoration",
    "volume_code": "V26",
    "category": "自然标本与化石 / 化石古生物",
    "definition_long": "依据恐龙骨架与化石推绘恐龙生态生活的科学复原图，古生物学经典题材，融合推断与想象复原。",
    "visual_effect": "呈恐龙拟真生态姿态配骨架对照的科学复原图样，生动而严密，传递古生物学的探索与推论气质。",
    "prompt_usage": "用于生成恐龙复原或博物馆科普；姿态与骨架对照须严谨以保科学推理可信度。",
    "use_cases": ["恐龙生态复原", "自然博物馆视觉", "古生物科普品牌"],
    "tags": ["恐龙", "复原", "古生物", "科普"],
    "status": "published",
    "version": "V1.0"
  },
  {
    "zh_term": "冰河时期生态图",
    "en_term": "Ice Age Ecology",
    "volume_code": "V26",
    "category": "自然标本与化石 / 化石古生物",
    "definition_long": "描绘更新世冰河期猛犸披毛犀等古生物群生态的古生物复原图，自然博物馆冰川厅典型题材。",
    "visual_effect": "呈猛犸披毛犀等冰河古动物群生态复原图，色彩苍凉辽阔，营造更新世冰原深时的复原意境。",
    "prompt_usage": "用于生成冰河时期复原或冰川厅科普；古动物群姿态与寒原环境须符合古生态推断。",
    "use_cases": ["冰川厅复原场景", "古生物科普插画", "自然博物馆视觉"],
    "tags": ["冰河期", "复原", "古生物", "猛犸"],
    "status": "published",
    "version": "V1.0"
  },
  {
    "zh_term": "石版画科学插图",
    "en_term": "Lithograph Science Plate",
    "volume_code": "V26",
    "category": "古典科学版画 / 古典科学版画",
    "definition_long": "以石版平版印刷石版纸绘制的彩色科学插图，19世纪博物志彩色石版画典型，色泽淡雅鲜明。",
    "visual_effect": "呈石版平印淡彩配细密黑线的科学图样，色调柔和工整，传递19世纪彩色石版博物画的古典气质。",
    "prompt_usage": "用于生成石版科学图或复古彩色科普；淡彩与黑线节奏须明确以保石版平印的古典质感。",
    "use_cases": ["彩色博物石版画", "复古科学品牌", "博物馆视觉"],
    "tags": ["石版", "平版", "版画", "博物"],
    "status": "published",
    "version": "V1.0"
  },
  {
    "zh_term": "雕版天文图",
    "en_term": "Engraved Astronomy",
    "volume_code": "V26",
    "category": "古典科学版画 / 古典科学版画",
    "definition_long": "以铜版雕版刻制的古典天文星宿轨道图，第谷开普勒时代星图典型，圆环星位精密富有装饰性。",
    "visual_effect": "呈铜版雕版的同心圆星宿轨道配黄道刻度的精密星图，典雅工整，传递天文学古典版的学术装饰气质。",
    "prompt_usage": "用于生成古典星图或科学版画；同心圆轨道与星位刻度须严密以保天文学版画古典质感。",
    "use_cases": ["古典星图设计", "天文学科普视觉", "复古星座品牌"],
    "tags": ["天文图", "雕版", "星图", "古典"],
    "status": "published",
    "version": "V1.0"
  },
  {
    "zh_term": "地图科学再绘",
    "en_term": "Cartographic Redraw",
    "volume_code": "V26",
    "category": "古典科学版画 / 古典科学版画",
    "definition_long": "以古典版画风格重绘的现代地图科学插图，等深线地形图与航海图典型，融合科学制图与古典版画美学。",
    "visual_effect": "呈等深线刻度的地形或航海配古代字体地名款式，工整凝古，传递古典制图的科学装饰气质。",
    "prompt_usage": "用于生成古典版画风地图或地理科普；等深线刻度与地名排版须严谨以保制图科学质感。",
    "use_cases": ["复古制图设计", "地理科普品牌", "装饰地图海报"],
    "tags": ["地图", "制图", "古典版画", "等深线"],
    "status": "published",
    "version": "V1.0"
  },
  {
    "zh_term": "显微观察素描",
    "en_term": "Microscopy Drawing",
    "volume_code": "V26",
    "category": "解剖与生物插画 / 细胞与微观世界",
    "definition_long": "以显微观察放大对象手绘的科学素描，胡克显微图谱经典，放大精确亦兼具艺术性。",
    "visual_effect": "呈放大对象配圆框与手绘笔触的科学微观素描，工整严谨，传递古典显微观察的探索科学气质。",
    "prompt_usage": "用于生成显微图谱或微观科学素描；圆框视图与笔触须明确以保留显微观察的古典科学感。",
    "use_cases": ["显微科学图谱", "微观科普教学", "复古生物科普"],
    "tags": ["显微", "观察素描", "微观", "胡克"],
    "status": "published",
    "version": "V1.0"
  },
  {
    "zh_term": "解剖学比例图",
    "en_term": "Anatomical Proportion",
    "volume_code": "V26",
    "category": "解剖与生物插画 / 脊椎动物解剖",
    "definition_long": "呈现生物体各部位比例标测的科学比例图，维特鲁威人与达芬奇人体比例典型著例。",
    "visual_effect": "呈人体或动物分部位配测度比例标线的图样，工整具度量感，传递古典人文与科学的结合气质。",
    "prompt_usage": "用于生成比例图或解剖比例示意；分部位比例标线与单位标号须严谨以保度量科学性。",
    "use_cases": ["人体比例教学", "学术解剖参考", "古典人文插画"],
    "tags": ["比例图", "解剖", "维特鲁威", "达芬奇"],
    "status": "published",
    "version": "V1.0"
  }
]