[
  {
    "zh_term": "万字纹",
    "en_term": "Wan Pattern",
    "volume_code": "V24",
    "category": "几何纹样 / 条纹格纹与回纹",
    "definition_long": "以中心十字四端直角延伸回转的连续几何纹样，源于佛家吉祥印记，中国传统寓意万福连绵。",
    "visual_effect": "呈十字四端直角卷绕的回环阵列，规整对称而绵延不断，传递吉祥延展的几何装饰感。",
    "prompt_usage": "用于生成中式边饰或满铺几何底纹；端头直角方向须一致以保持视觉规整统一。",
    "use_cases": ["中式窗格装饰", "传统织物底纹", "礼品边饰纹样"],
    "tags": ["万字纹", "几何纹", "中式", "回环"],
    "status": "published",
    "version": "V1.0"
  },
  {
    "zh_term": "锁子甲纹",
    "en_term": "Chainmail Pattern",
    "volume_code": "V24",
    "category": "几何纹样 / 条纹格纹与回纹",
    "definition_long": "以圆环相套连缀成网的几何纹样，源自铁甲锁子甲的环扣结构，象征连续坚固防御。",
    "visual_effect": "呈等大环扣相套的网格阵列，环环相连而均匀致密，散发金属质感的链式装饰骨架。",
    "prompt_usage": "用于生成武士装甲或金属感底纹；环径与扣搭位置须统一避免错位松散。",
    "use_cases": ["盔甲金属底纹", "复古硬朗背景", "服饰铠甲印花"],
    "tags": ["锁子甲", "几何纹", "环扣", "金属"],
    "status": "published",
    "version": "V1.0"
  },
  {
    "zh_term": "冰裂纹",
    "en_term": "Ice Crackle",
    "volume_code": "V24",
    "category": "几何纹样 / 条纹格纹与回纹",
    "definition_long": "以不规则多边形裂面拼贴布满画面的几何纹样，源自哥窑冰裂釉面，呈自然碎裂结构。",
    "visual_effect": "呈不规则多边形相拼的整面碎片网络，裂线随机而均衡，营造古朴静谧的纹理装饰效果。",
    "prompt_usage": "用于生成陶瓷冰裂或复古碎块背景；裂线分布与多边形面积须维持随机不重复图案。",
    "use_cases": ["哥窑冰裂纹底", "陶瓷釉面纹理", "新中式装饰背板"],
    "tags": ["冰裂纹", "几何纹", "陶瓷", "碎裂"],
    "status": "published",
    "version": "V1.0"
  },
  {
    "zh_term": "忍冬纹",
    "en_term": "Honeysuckle Motif",
    "volume_code": "V24",
    "category": "植物与缠枝纹样 / 宝相与缠枝纹",
    "definition_long": "以忍冬叶三裂卷曲连续排列的植物纹样，南北朝随佛教传入，象征顽强绵延的生命。",
    "visual_effect": "呈三裂叶状波形连续排布，叶端卷曲，节奏顺滑而舒展，赋予边饰以清雅绵延的装饰韵律。",
    "prompt_usage": "用于生成佛教或古典边饰；叶裂方向与连续波轴须明确保持节奏一致。",
    "use_cases": ["石窟边饰装饰", "佛教器物描边", "古典织物纹样"],
    "tags": ["忍冬纹", "缠枝", "植物纹", "边饰"],
    "status": "published",
    "version": "V1.0"
  },
  {
    "zh_term": "缠枝葡萄",
    "en_term": "Scrolling Grape",
    "volume_code": "V24",
    "category": "植物与缠枝纹样 / 宝相与缠枝纹",
    "definition_long": "以连续藤蔓串联葡萄叶果呈波状缠绕的植物纹样，唐镜唐银器典型，寓意丰收绵延。",
    "visual_effect": "呈藤蔓起伏、果穗与叶片间隔布列的繁茂纹饰，节奏饱满，营造西来富丽的装饰主轴。",
    "prompt_usage": "用于生成唐风金属器或织物纹饰；果穗节点位置与叶距须等距保持连续节奏。",
    "use_cases": ["唐镜背纹", "金属酒具纹饰", "织物装饰主纹"],
    "tags": ["缠枝葡萄", "唐风", "缠枝", "植物纹"],
    "status": "published",
    "version": "V1.0"
  },
  {
    "zh_term": "唐草纹",
    "en_term": "Tang Grass Scroll",
    "volume_code": "V24",
    "category": "植物与缠枝纹样 / 宝相与缠枝纹",
    "definition_long": "以多种植物藤蔓综合变形呈规则波状连续的缠枝纹样，唐代定型，日本沿用称唐草。",
    "visual_effect": "呈波状主干匀整起伏、花叶规整布列的连续装饰带，节奏端庄绵长，传递典雅延展感。",
    "prompt_usage": "用于生成古典连续边饰或器物主带；主干波形与叶位间距须等距严谨以保连续纪律。",
    "use_cases": ["日式唐草织物", "古典器物边饰", "建筑装饰彩绘"],
    "tags": ["唐草", "缠枝", "波状", "连续纹"],
    "status": "published",
    "version": "V1.0"
  },
  {
    "zh_term": "西番莲纹",
    "en_term": "Passionflower Scroll",
    "volume_code": "V24",
    "category": "植物与缠枝纹样 / 宝相与缠枝纹",
    "definition_long": "以莲花状五爪花与螺旋藤蔓组合的缠枝纹样，明清借自西番莲形，盛行家具瓷器雕饰。",
    "visual_effect": "呈五爪放射花配螺旋藤蔓的繁复装饰，结构对称华丽，赋予明清家具以繁丽西式装饰气息。",
    "prompt_usage": "用于生成明清家具或西式缠枝主纹；花的放射对称与藤蔓走向须明确以免乱形。",
    "use_cases": ["明清家具雕花", "瓷器缠枝主纹", "屏风浮雕装饰"],
    "tags": ["西番莲", "缠枝", "明清", "浮雕"],
    "status": "published",
    "version": "V1.0"
  },
  {
    "zh_term": "蓝印花布纹",
    "en_term": "Blue Calico",
    "volume_code": "V24",
    "category": "民族与地域图案 / 佩斯利与中东纹样",
    "definition_long": "以镂花纸版刮浆染色而成的白底蓝花或蓝底白花民间棉布图案，江浙传统手工印染典型。",
    "visual_effect": "呈靛蓝底留白花或白底蓝印的散点或满地纹样，色彩简洁，传递质朴清新的乡土装饰气息。",
    "prompt_usage": "用于生成蓝印花布或质朴乡村风面料；纹样轮廓须硬边断口以仿版染手作质感。",
    "use_cases": ["民俗蓝印花布", "乡风家纺面料", "新中式装饰底纹"],
    "tags": ["蓝印花布", "民俗", "印染", "江浙"],
    "status": "published",
    "version": "V1.0"
  },
  {
    "zh_term": "扎染图案",
    "en_term": "Tie-Dye Pattern",
    "volume_code": "V24",
    "category": "民族与地域图案 / 佩斯利与中东纹样",
    "definition_long": "以线扎布料浸染后松扎形成晕染斑驳的民间图案，云南白族典型，纹边柔和晕散。",
    "visual_effect": "呈扎斑染晕渗的不规则色斑分布，边缘柔散过渡，营造自然手工的民俗肌理装饰感。",
    "prompt_usage": "用于生成手工扎染或波西米亚风面料；扎斑位置与晕染外扩须随机扩散才能保真实手作感。",
    "use_cases": ["白族扎染服饰", "波西米亚面料", "民俗家纺装饰"],
    "tags": ["扎染", "白族", "晕染", "民俗"],
    "status": "published",
    "version": "V1.0"
  },
  {
    "zh_term": "和服纹样",
    "en_term": "Kimono Motif",
    "volume_code": "V24",
    "category": "民族与地域图案 / 佩斯利与中东纹样",
    "definition_long": "以季节动植物与家纹为主题手工绘制或染织于和服的传统日本图案，讲究留白与意境。",
    "visual_effect": "呈对称或留白散布的樱花菊水家纹等动植物纹样，色调雅淡，传递日式写意的装饰格调。",
    "prompt_usage": "用于生成和服或日式风格人物服饰图案；季节主题与留白比须明确避免塞满破坏意境。",
    "use_cases": ["和服染织图案", "日式海报装饰", "日风品牌包装"],
    "tags": ["和服", "日本", "家纹", "染织"],
    "status": "published",
    "version": "V1.0"
  },
  {
    "zh_term": "波状连续",
    "en_term": "Wave Repeat",
    "volume_code": "V24",
    "category": "连续与重复排列 / 二方与四方连续",
    "definition_long": "以波状曲线为骨架串联单元沿单一方向重复延伸的连续纹，节奏起伏流畅，常作边饰。",
    "visual_effect": "呈连续波线串接单元的稳定带状节奏，起伏均匀，营造动感而连贯的装饰韵律。",
    "prompt_usage": "用于生成古典波状边饰或动感带纹；波线波长与振幅须等距统一避免节奏紊乱。",
    "use_cases": ["器物波状边饰", "织物动感滚边", "海报分隔花边"],
    "tags": ["波状", "二方连续", "边饰", "节奏"],
    "status": "published",
    "version": "V1.0"
  },
  {
    "zh_term": "网状连续",
    "en_term": "Net Repeat",
    "volume_code": "V24",
    "category": "连续与重复排列 / 二方与四方连续",
    "definition_long": "以交织网格为骨架使单元沿上下左右延展的四方连续纹，网线交接多成菱格或正方。",
    "visual_effect": "呈均线斜交或正交的网格结构，节点规律布花，传递严密规整的满铺装饰秩序感。",
    "prompt_usage": "用于生成面料或网格底纹满铺；交点形式与节点纹样须统一以保全网一致节奏。",
    "use_cases": ["蕾丝面料底纹", "网状满铺背景", "网格规整花砖"],
    "tags": ["网状", "四方连续", "满铺", "交织"],
    "status": "published",
    "version": "V1.0"
  },
  {
    "zh_term": "阶梯连续",
    "en_term": "Stepped Repeat",
    "volume_code": "V24",
    "category": "连续与重复排列 / 二方与四方连续",
    "definition_long": "以单元逐级错位或上下偏移重复延伸的排布方式，呈阶梯状节奏，南美安第斯纹典型。",
    "visual_effect": "呈单元逐级递进错位的连续带，节奏起伏与进深感强，营造秩序动感的装饰韵律。",
    "prompt_usage": "用于生成安第斯或几何错位边饰；错位步距与单元大小须固定以保统一递进节奏。",
    "use_cases": ["安第斯织物纹", "几何错位边饰", "复古动感底纹"],
    "tags": ["阶梯", "连续", "错位", "几何"],
    "status": "published",
    "version": "V1.0"
  },
  {
    "zh_term": "几何阿拉伯式",
    "en_term": "Arabesque Geometry",
    "volume_code": "V24",
    "category": "装饰风格流派 / 中东伊斯兰装饰流派 / 几何与植物交织",
    "definition_long": "以多边形星线与植物藤蔓交织延展的阿拉伯式装饰，伊斯兰艺术典型，象征无穷延展。",
    "visual_effect": "呈星形几何与卷草交织铺陈的繁复满地纹，无限延伸的网状节奏，营造神秘华丽的装饰气场。",
    "prompt_usage": "用于生成伊斯兰式满铺或穹顶装饰；几何骨架与植物缠绕须成体系化避免拼凑失真。",
    "use_cases": ["清真寺穹顶装饰", "伊斯兰书籍页饰", "中东风格海报"],
    "tags": ["阿拉伯式", "几何", "伊斯兰", "交织"],
    "status": "published",
    "version": "V1.0"
  },
  {
    "zh_term": "摩尔拱花饰",
    "en_term": "Moorish Arcade",
    "volume_code": "V24",
    "category": "装饰风格流派 / 中东伊斯兰装饰流派 / 几何与植物交织",
    "definition_long": "以马蹄拱与蜂巢钟乳拱内填几何星线的摩尔式装饰，西班牙安达卢斯伊斯兰建筑典型。",
    "visual_effect": "呈马蹄拱轮廓内密集星线层叠的繁密装饰，结构精致错综，传递异域宫廷的雕饰气场。",
    "prompt_usage": "用于生成阿尔罕布拉式拱廊或壁饰；拱形与内填星线密度须明确以避免装饰糊化。",
    "use_cases": ["阿尔罕布拉式壁饰", "摩尔风格建筑", "异域室内装饰"],
    "tags": ["摩尔", "拱饰", "伊斯兰", "安达卢斯"],
    "status": "published",
    "version": "V1.0"
  },
  {
    "zh_term": "拜占庭金底纹",
    "en_term": "Byzantine Gold Ground",
    "volume_code": "V24",
    "category": "装饰风格流派 / 欧洲古典装饰流派 / 拜占庭风",
    "definition_long": "以金箔满底衬托圣像与几何花边的拜占庭装饰风格，东罗马教堂镶嵌画与圣器典型。",
    "visual_effect": "呈金色满底上规整几何花边描边的圣像装饰，庄严辉煌，营造神圣神性的装饰氛围。",
    "prompt_usage": "用于生成拜占庭圣像或金底宗教装饰；金箔色调与几何花边须明确避免饱和失真。",
    "use_cases": ["拜占庭圣像画", "宗教器物描金", "东正教装饰背景"],
    "tags": ["拜占庭", "金底", "镶嵌", "宗教"],
    "status": "published",
    "version": "V1.0"
  },
  {
    "zh_term": "哥特玫瑰花窗",
    "en_term": "Gothic Rose Window",
    "volume_code": "V24",
    "category": "装饰风格流派 / 欧洲古典装饰流派 / 哥特式",
    "definition_long": "以圆形窗格内对称放射辐条与花叶透雕组合的哥特式窗饰，欧洲大教堂立面典型。",
    "visual_effect": "呈圆形骨架对称放射分格、内嵌花叶透雕的窗花，结构繁复庄严，传递哥特神性装饰感。",
    "prompt_usage": "用于生成哥特大教堂窗或花窗装饰；放射分格数与内嵌透雕花纹须明确对称统一。",
    "use_cases": ["哥特教堂花窗", "古典装饰背景", "建筑纹饰参考"],
    "tags": ["哥特", "玫瑰花窗", "教堂", "透雕"],
    "status": "published",
    "version": "V1.0"
  },
  {
    "zh_term": "堆贴沥粉",
    "en_term": "Stucco Relief",
    "volume_code": "V24",
    "category": "纹饰肌理 / 立体装饰肌理",
    "definition_long": "以石灰或胶粉浆堆贴于建筑墙面形成的浅浮雕立体装饰技法，伊斯兰与古建常见。",
    "visual_effect": "呈墙面浅浮雕连续几何或植物凸饰，光影柔和而详密，营造精致立体的肌理装饰感。",
    "prompt_usage": "用于生成伊斯兰或古建墙面浅浮雕装饰；凸起高度与纹样轮廓须统一保持肌理一致。",
    "use_cases": ["伊斯兰墙面浮雕", "古建天花装饰", "西式壁面描花"],
    "tags": ["堆贴", "沥粉", "浮雕", "肌理"],
    "status": "published",
    "version": "V1.0"
  },
  {
    "zh_term": "掐丝珐琅纹",
    "en_term": "Cloisonne Motif",
    "volume_code": "V24",
    "category": "纹饰肌理 / 立体装饰肌理",
    "definition_long": "以金属铜丝掐成花纹隔填釉料烧制的立体纹饰，景泰蓝工艺典型，色彩鲜明边界硬朗。",
    "visual_effect": "呈金属丝勾边内填鲜艳釉色的几何花卉纹饰，色块端正边界清晰，营造华贵立体的装饰肌理。",
    "prompt_usage": "用于生成景泰蓝器面纹饰；铜丝轮廓与釉色分区须明确以保硬边填色的工艺质感。",
    "use_cases": ["景泰蓝器面装饰", "传统礼器纹饰", "复古工艺品牌"],
    "tags": ["掐丝", "珐琅", "景泰蓝", "立体"],
    "status": "published",
    "version": "V1.0"
  }
]