[
  {
    "zh_term": "文生视频", "en_term": "Text-to-Video",
    "aliases": ["T2V"],
    "volume_code": "V16", "category": "生成模式",
    "definition_long": "仅凭文字描述直接生成动态视频的生成模式，是 AI 视频最基础的入口。提示词需同时交代主体、动作、镜头与画面风格，信息越完整、运动与画面越稳定。",
    "visual_effect": "从无到有生成完整动态画面，运动与构图由文字驱动。",
    "prompt_usage": "在视频模型里作为基础模式，配合主体+动作+运镜+风格词使用。",
    "use_cases": ["短视频", "概念演示", "创意预演"],
    "related_terms": ["图生视频"], "confused_with": ["图生视频"],
    "tags": ["AI视频", "生成模式", "文生视频"],
    "source_refs": "整理", "status": "published", "version": "V1.0"
  },
  {
    "zh_term": "图生视频", "en_term": "Image-to-Video",
    "aliases": ["I2V"],
    "volume_code": "V16", "category": "生成模式",
    "definition_long": "以一张静态图作为首帧或参考来驱动其产生运动的生成模式，能更好锁定构图、角色与画风，可控性高于纯文生视频，是商用落地最常用的方式。",
    "visual_effect": "静态图被赋予镜头与主体运动，画风与构图高度保持。",
    "prompt_usage": "先定好首帧图，再用文字描述希望发生的运动与运镜。",
    "use_cases": ["产品动效", "角色动画", "海报动起来"],
    "related_terms": ["文生视频", "首尾帧生成"], "confused_with": ["文生视频"],
    "tags": ["AI视频", "生成模式", "图生视频"],
    "source_refs": "整理", "status": "published", "version": "V1.0"
  },
  {
    "zh_term": "首尾帧生成", "en_term": "First-and-Last-Frame Generation",
    "aliases": ["首尾帧", "关键帧补间"],
    "volume_code": "V16", "category": "生成模式 / 关键帧驱动",
    "definition_long": "分别指定起始帧与结束帧、由模型补全中间过渡的生成方式，适合做精确的形变、转场与定向运动，对镜头落点与画面收尾的控制力最强。",
    "visual_effect": "画面在两张指定图之间平滑演化，过渡自然可控。",
    "prompt_usage": "上传首帧与尾帧，用文字补充中间运动的方式与节奏。",
    "use_cases": ["转场", "形变动画", "精确分镜"],
    "related_terms": ["图生视频"], "confused_with": [],
    "tags": ["AI视频", "关键帧", "首尾帧"],
    "source_refs": "整理", "status": "published", "version": "V1.0"
  },
  {
    "zh_term": "运动笔刷", "en_term": "Motion Brush",
    "aliases": ["运动刷"],
    "volume_code": "V16", "category": "运动控制与条件",
    "definition_long": "在画面上手动涂抹区域并为其指定运动方向与幅度的控制工具，让被选中的主体动起来、其余区域保持静止，实现局部可控运动。",
    "visual_effect": "指定区域按箭头方向运动，其余画面稳定不漂移。",
    "prompt_usage": "在支持的模型中圈选主体并给方向，配合文字描述强化运动。",
    "use_cases": ["局部动效", "精准控制", "产品展示"],
    "related_terms": ["相机轨迹控制", "运动轨迹"], "confused_with": [],
    "tags": ["AI视频", "运动控制", "运动笔刷"],
    "source_refs": "整理", "status": "published", "version": "V1.0"
  },
  {
    "zh_term": "相机轨迹控制", "en_term": "Camera Trajectory Control",
    "aliases": ["镜头轨迹"],
    "volume_code": "V16", "category": "运动控制与条件",
    "definition_long": "为虚拟摄影机预设运动路径（推拉、摇移、环绕等）的控制方式，使镜头运动可复现、可量化调节，是获得稳定专业运镜的关键手段。",
    "visual_effect": "镜头沿设定路径平滑运动，运镜专业可控。",
    "prompt_usage": "选择或绘制镜头路径，配合运镜术语描述速度与幅度。",
    "use_cases": ["专业运镜", "稳定镜头", "复现镜头"],
    "related_terms": ["运动笔刷", "环绕镜头"], "confused_with": [],
    "tags": ["AI视频", "运动控制", "相机轨迹"],
    "source_refs": "整理", "status": "published", "version": "V1.0"
  },
  {
    "zh_term": "角色一致性", "en_term": "Character Consistency",
    "aliases": ["人物一致性"],
    "volume_code": "V16", "category": "时序与一致性",
    "definition_long": "在多帧或多镜头之间维持同一角色的面部、服装与体型不漂移的能力，是 AI 视频做连贯叙事与系列内容的核心难点与关键指标。",
    "visual_effect": "同一角色跨镜头保持长相、服装与身形稳定。",
    "prompt_usage": "用参考图或角色锚定功能锁定形象，描述时保持特征词一致。",
    "use_cases": ["连续叙事", "系列短片", "虚拟角色"],
    "related_terms": ["时序一致性"], "confused_with": [],
    "tags": ["AI视频", "一致性", "角色"],
    "source_refs": "整理", "status": "published", "version": "V1.0"
  },
  {
    "zh_term": "推近镜头", "en_term": "Camera Push In",
    "aliases": ["推镜", "Dolly In"],
    "volume_code": "V16", "category": "运镜与镜头控制 / 平移推拉",
    "definition_long": "摄影机向被摄主体靠近、主体在画面中逐渐放大的运镜，强化观众的关注与代入感，常用于情绪递进与揭示细节。",
    "visual_effect": "主体逐渐放大、背景相对收拢，注意力向中心聚集。",
    "prompt_usage": "描述运动时写明缓慢/快速推近与落幅，强调情绪积累。",
    "use_cases": ["情绪强化", "细节揭示", "登场"],
    "related_terms": ["拉远镜头", "环绕镜头"], "confused_with": ["拉远镜头"],
    "tags": ["AI视频", "运镜", "推镜"],
    "source_refs": "整理", "status": "published", "version": "V1.0"
  },
  {
    "zh_term": "环绕镜头", "en_term": "Orbit Shot",
    "aliases": ["环绕运镜", "Arc Shot"],
    "volume_code": "V16", "category": "运镜与镜头控制 / 环绕跟随",
    "definition_long": "摄影机绕主体做弧线或整圈运动的运镜，强烈展现主体立体感与所处空间关系，常用于角色亮相、产品全景展示与高潮段落。",
    "visual_effect": "主体居中、背景旋转环绕，立体感与空间感强烈。",
    "prompt_usage": "写明顺/逆时针、半圈或整圈及速度，配合主体保持居中。",
    "use_cases": ["角色登场", "产品展示", "高潮镜头"],
    "related_terms": ["推近镜头", "相机轨迹控制"], "confused_with": [],
    "tags": ["AI视频", "运镜", "环绕"],
    "source_refs": "整理", "status": "published", "version": "V1.0"
  },
  {
    "zh_term": "航拍俯冲", "en_term": "Aerial Dive Shot",
    "aliases": ["俯冲镜头", "FPV俯冲"],
    "volume_code": "V16", "category": "运镜与镜头控制 / 空中机位",
    "definition_long": "镜头从高空快速向下俯冲、逼近目标的运镜，带来强烈的空间纵深与冲击力，常见于风光大场面与穿越机风格开场。",
    "visual_effect": "画面从高空急速下压逼近地面目标，纵深冲击强。",
    "prompt_usage": "强调高度落差与俯冲速度，配合广角与风光场景。",
    "use_cases": ["风光大片", "开场镜头", "穿越机风格"],
    "related_terms": ["环绕镜头"], "confused_with": [],
    "tags": ["AI视频", "运镜", "航拍"],
    "source_refs": "整理", "status": "published", "version": "V1.0"
  },
  {
    "zh_term": "手持晃动", "en_term": "Handheld Shaky Cam",
    "aliases": ["手持感", "纪实抖动"],
    "volume_code": "V16", "category": "运镜与镜头控制 / 手持",
    "definition_long": "模拟手持拍摄的轻微不规则抖动，打破机械稳定感，增强临场、纪实与紧张氛围，常用于动作、惊悚与伪纪录片风格。",
    "visual_effect": "画面带轻微随机晃动，真实感与紧张感增强。",
    "prompt_usage": "写明手持/晃动幅度，配合动作或纪实场景，勿与稳定运镜混用。",
    "use_cases": ["动作戏", "纪实风格", "惊悚氛围"],
    "related_terms": ["航拍俯冲"], "confused_with": ["稳定运镜"],
    "tags": ["AI视频", "运镜", "手持"],
    "source_refs": "整理", "status": "published", "version": "V1.0"
  },
  {
    "zh_term": "慢动作", "en_term": "Slow Motion",
    "aliases": ["升格", "Slow-mo"],
    "volume_code": "V16", "category": "运动风格与质感",
    "definition_long": "以高帧率拍摄后放慢播放、使动作细节被拉长呈现的时间风格，强调张力、质感与情绪，常用于水花、奔跑、回眸等瞬间。",
    "visual_effect": "动作被显著放慢，细节与轨迹清晰、富有张力。",
    "prompt_usage": "加入慢动作/升格描述，配合有动势的主体与动作。",
    "use_cases": ["情绪镜头", "运动细节", "广告质感"],
    "related_terms": ["延时摄影"], "confused_with": ["延时摄影"],
    "tags": ["AI视频", "运动风格", "慢动作"],
    "source_refs": "整理", "status": "published", "version": "V1.0"
  },
  {
    "zh_term": "延时摄影", "en_term": "Time-lapse",
    "aliases": ["延时", "缩时"],
    "volume_code": "V16", "category": "运动风格与质感",
    "definition_long": "将长时间过程压缩成数秒快放的时间风格，凸显云移、人流、日夜更替等宏观节奏与变化，与慢动作方向相反。",
    "visual_effect": "时间被压缩快放，宏观变化连贯流动。",
    "prompt_usage": "写明延时/缩时及对象（云、人流、日落），强调过程压缩。",
    "use_cases": ["城市空镜", "自然变化", "氛围铺垫"],
    "related_terms": ["慢动作"], "confused_with": ["慢动作"],
    "tags": ["AI视频", "运动风格", "延时"],
    "source_refs": "整理", "status": "published", "version": "V1.0"
  },
  {
    "zh_term": "24帧电影感", "en_term": "24fps Cinematic",
    "aliases": ["24fps", "电影帧率"],
    "volume_code": "V16", "category": "时序与一致性 / 帧率",
    "definition_long": "每秒 24 帧的播放帧率，带有标志性的电影运动模糊与节奏感，区别于高帧率的顺滑感，是营造电影质感的基础设定。",
    "visual_effect": "画面带电影式运动模糊与沉稳节奏。",
    "prompt_usage": "需要电影质感时指定 24fps，配合电影调色与运镜。",
    "use_cases": ["电影质感", "叙事短片"],
    "related_terms": ["慢动作"], "confused_with": ["60帧顺滑"],
    "tags": ["AI视频", "帧率", "电影感"],
    "source_refs": "整理", "status": "published", "version": "V1.0"
  },
  {
    "zh_term": "可灵", "en_term": "Kling",
    "aliases": ["Kling", "快手可灵"],
    "volume_code": "V16", "category": "视频生成模型",
    "definition_long": "快手推出的中文视频生成模型，以较长可用时长与较好的运动合理性著称，可作为风格/平台参照词，提示其偏写实流畅的运动表现。",
    "visual_effect": "运动连贯合理、时长较长，整体偏写实。",
    "prompt_usage": "作为平台/风格参照标注，提示偏写实流畅的运动。",
    "use_cases": ["平台参照", "写实运动"],
    "related_terms": ["Runway Gen-3"], "confused_with": [],
    "tags": ["AI视频", "视频模型", "可灵"],
    "source_refs": "整理", "status": "published", "version": "V1.0"
  },
  {
    "zh_term": "Runway Gen-3", "en_term": "Runway Gen-3 Alpha",
    "aliases": ["Gen-3", "Runway"],
    "volume_code": "V16", "category": "视频生成模型",
    "definition_long": "Runway 的视频生成模型，主打高保真画面与可控运镜，支持运动笔刷与相机控制，常作为视频生成的平台/风格参照词。",
    "visual_effect": "画面保真度高、运镜可控，质感偏精致。",
    "prompt_usage": "作为平台/风格参照标注，提示高保真与可控运镜。",
    "use_cases": ["平台参照", "高保真画面"],
    "related_terms": ["可灵"], "confused_with": [],
    "tags": ["AI视频", "视频模型", "Runway"],
    "source_refs": "整理", "status": "published", "version": "V1.0"
  }
]
