[
  {"term_uid":"","zh_term":"单色标志","en_term":"Monochrome Logo","volume_code":"V22","category":"标志与字标 / 单色标","definition_long":"单色标志是仅以一种颜色可重现的标识形式，强反差适配复印、激光雕刻与单色印刷，是VI中最低保障版本必备。","visual_effect":"单色可印、反差强、低保障版。","prompt_usage":"用于仅以一种颜色复印雕刻重现的单色标志。","use_cases":["标志","单色"],"tags":["单色","反差","VI备份"],"status":"published","version":"V1.0"},
  {"term_uid":"","zh_term":"反白标志","en_term":"Reverse Logo","volume_code":"V22","category":"标志与字标 / 反白标","definition_long":"反白标志是标志在深色背景下的反色版本，需保证识别度与笔画不糊，与彩色版同等重要是VI必备的应用版本。","visual_effect":"深底反色、识别保留、笔画不糊。","prompt_usage":"用于深色背景下反色保留识别的反白标志版本。","use_cases":["标志","反白"],"tags":["反白","反色","VI备份"],"status":"published","version":"V1.0"},
  {"term_uid":"","zh_term":"水平比例版","en_term":"Horizontal Lockup","volume_code":"V22","category":"标志与字标 / 比例版","definition_long":"水平比例版是图形与文字水平排列的标志布局，适合横幅顶部与宽版应用，是组合标志的常规比例版本之一。","visual_effect":"图文水平、横幅顶用、宽版适配。","prompt_usage":"用于图文水平排列适配横幅宽版的水平比例标志。","use_cases":["标志","比例版"],"tags":["比例版","水平","宽版"],"status":"published","version":"V1.0"},
  {"term_uid":"","zh_term":"垂直比例版","en_term":"Vertical Lockup","volume_code":"V22","category":"标志与字标 / 比例版","definition_long":"垂直比例版是图形在上文字在下的纵向排列标志布局，适合正方形空间与窄宽度应用，是组合标志的另一比例版本。","visual_effect":"图上文下、纵向窄版、正方适配。","prompt_usage":"用于图上文下适配窄版正方空间的垂直比例标志。","use_cases":["标志","比例版"],"tags":["比例版","垂直","窄版"],"status":"published","version":"V1.0"},
  {"term_uid":"","zh_term":"最小尺寸","en_term":"Minimum Size","volume_code":"V22","category":"栅格与造型规范 / 最小尺寸","definition_long":"最小尺寸是VI规范中标志可印刷的最小尺寸下限，按像素或毫米规定保证笔画不糊可读，是品质控制的红线。","visual_effect":"最小下限、笔画不糊、品质红线。","prompt_usage":"用于保证标志在小尺寸印刷不糊的最小尺寸规范。","use_cases":["规范","最小尺寸"],"tags":["最小尺寸","规范","红线"],"status":"published","version":"V1.0"},
  {"term_uid":"","zh_term":"安全空间","en_term":"Clear Space","volume_code":"V22","category":"栅格与造型规范 / 安全空间","definition_long":"安全空间是标志四周必须保留的最小空白隔离区，按标志内某元素高度的倍数计算，禁止其他元素入侵保证识别不受扰。","visual_effect":"四周隔离、倍数计算、识别保护。","prompt_usage":"用于保证标志识别不受扰的最小安全隔离空间规范。","use_cases":["规范","安全空间"],"tags":["安全空间","隔离","规范"],"status":"published","version":"V1.0"},
  {"term_uid":"","zh_term":"品牌字体规范","en_term":"Brand Typography","volume_code":"V22","category":"品牌标识应用 / 品牌字体","definition_long":"品牌字体规范是VI规定品牌专用字体与字体层级（标题/副标/正文）的字号字重行距规范，约束跨媒介文字呈现统一性。","visual_effect":"专用字族、层级规范、跨媒统一。","prompt_usage":"用于规定品牌专用字体与字号字重层级的字体规范。","use_cases":["品牌","字体规范"],"tags":["字体","规范","VI"],"status":"published","version":"V1.0"},
  {"term_uid":"","zh_term":"名片应用","en_term":"Business Card Application","volume_code":"V22","category":"品牌标识应用 / 名片","definition_long":"名片应用是VI规范中名片版式的标志摆放、信息层级与材质工艺规定，是最基础也是最高频的品牌物料落地示例。","visual_effect":"名片版式、层级清晰、材质工艺。","prompt_usage":"用于规范名片版式标志摆放与材质工艺的品牌应用。","use_cases":["品牌","名片"],"tags":["名片","版式","VI"],"status":"published","version":"V1.0"},
  {"term_uid":"","zh_term":"信封信纸","en_term":"Letterhead Envelope","volume_code":"V22","category":"品牌标识应用 / 文具","definition_long":"信封信纸是VI中办公用品基础物料的版式规范，规定标志位置、抬头信息与文字排版，是书面商务沟通的品牌承载。","visual_effect":"办公文具、抬头信息、书面承载。","prompt_usage":"用于规范办公信封信纸抬头与标志摆放的VI物料。","use_cases":["品牌","文具"],"tags":["信封信纸","文具","VI"],"status":"published","version":"V1.0"},
  {"term_uid":"","zh_term":"徽章变体","en_term":"Badge Variant","volume_code":"V22","category":"标志与字标 / 徽章变体","definition_long":"徽章变体是标志在限定圆形或盾形容器内的适配版本，常作社群头像与社交衍生应用，保留识别核心但适配异形容器。","visual_effect":"圆形盾形、头像适配、异形容器。","prompt_usage":"用于适配限定圆形盾形容器的徽章变体标志版本。","use_cases":["标志","变体"],"tags":["徽章","变体","头像"],"status":"published","version":"V1.0"},
  {"term_uid":"","zh_term":"字体图形标志","en_term":"Letterform Mark","volume_code":"V22","category":"标志与字标 / 字母字体标","definition_long":"字体图形标志是以单字母经几何变形传达品牌个性的标识形式，介于字母标与抽象标之间，依赖字型造型识别度高。","visual_effect":"单字母变形、字型造型、介于字母标与抽象。","prompt_usage":"用于单字母几何变形传达个性的字母字体标志性。","use_cases":["标志","字母字体标"],"tags":["字型","变形","字母"],"status":"published","version":"V1.0"},
  {"term_uid":"","zh_term":"图标语义层","en_term":"Icon Semantic Layer","volume_code":"V22","category":"图标系统 / 语义层","definition_long":"图标语义层是图标系统按抽象程度分层（核心功能、操作动作、状态指示）的语义组织，便于使用与跨平台一致替换。","visual_effect":"分层组织、抽象分级、跨平台替换。","prompt_usage":"用于按抽象程度分层的图标系统语义层组织。","use_cases":["图标","语义层"],"tags":["语义层","分层","系统"],"status":"published","version":"V1.0"},
  {"term_uid":"","zh_term":"状态图标","en_term":"Status Icon","volume_code":"V22","category":"图标系统 / 状态图标","definition_long":"状态图标指示系统或操作当前状态（在线离线、加载完成错误），需色彩与图形双重编码且状态过渡自然易识别。","visual_effect":"双重编码、状态指示、过渡易识。","prompt_usage":"用于指示系统或操作当前状态的状态图标设计。","use_cases":["图标","状态"],"tags":["状态","编码","指示"],"status":"published","version":"V1.0"},
  {"term_uid":"","zh_term":"手势图标","en_term":"Gesture Icon","volume_code":"V22","category":"图标系统 / 手势图标","definition_long":"手势图标以手部简化图形指示触屏或体感的操作手势，需识别度高、避免手指遮挡歧义，常见移动端与体感交互教程。","visual_effect":"手部简化、触屏体感、避免歧义。","prompt_usage":"用于指示触屏与体感操作手势的简化手部图标。","use_cases":["图标","手势"],"tags":["手势","触屏","体感"],"status":"published","version":"V1.0"},
  {"term_uid":"","zh_term":"数据统计符号","en_term":"Statistical Glyph","volume_code":"V22","category":"象形与符号 / 统计符号","definition_long":"统计符号是数据图表中表达涨跌与对比的符号体系（上下箭头、柱条颜色），颜色与方向双重编码避免色盲歧义是关键。","visual_effect":"方向箭头、颜色编码、色盲友好。","prompt_usage":"用于数据图表方向与涨跌对比的双重编码符号。","use_cases":["符号","统计"],"tags":["统计","箭头","色盲"],"status":"published","version":"V1.0"},
  {"term_uid":"","zh_term":"ISO符号","en_term":"ISO Symbol","volume_code":"V22","category":"象形与符号 / ISO符号","definition_long":"ISO符号是国际标准化组织规定的图形符号体系，含公共信息、安全、防火等类别，国际通用识别度强受法律约束定型。","visual_effect":"国际标准、公共安全、法约定型。","prompt_usage":"用于ISO国际标准化公共安全图形符号体系。","use_cases":["符号","ISO"],"tags":["ISO","标准","公共"],"status":"published","version":"V1.0"},
  {"term_uid":"","zh_term":"品牌IP形象","en_term":"Brand IP Character","volume_code":"V22","category":"品牌标识应用 / IP形象","definition_long":"品牌IP形象是以拟人化角色长期承载品牌人格的视觉资产，需多表情姿势场景扩展与性格设定，是品牌代言的高级形式。","visual_effect":"拟人长线、多扩展、性格设定。","prompt_usage":"用于承载品牌人格的拟人化长期IP形象资产。","use_cases":["品牌","IP"],"tags":["IP","拟人","长线"],"status":"published","version":"V1.0"},
  {"term_uid":"","zh_term":"品牌动效","en_term":"Motion Branding","volume_code":"V22","category":"品牌标识应用 / 品牌动效","definition_long":"品牌动效是品牌在影片与界面中标志的动态演绎，按品牌节奏规定出现停留与离开的动效曲线，是数字品牌识别的延展。","visual_effect":"标志动态、节奏曲线、数字延展。","prompt_usage":"用于规定品牌标志在影片与界面动态演绎的动效规范。","use_cases":["品牌","动效"],"tags":["动效","品牌","数字"],"status":"published","version":"V1.0"},
  {"term_uid":"","zh_term":"品牌声音","en_term":"Sonic Branding","volume_code":"V22","category":"品牌标识应用 / 品牌声音","definition_long":"品牌声音是品牌听觉识别的标志性音效或旋律，与视觉标志共同承载品牌记忆，是跨感官品牌系统的听觉组成。","visual_effect":"听觉识别、跨感官、标志性旋律。","prompt_usage":"用于承载品牌识别的听觉标志性音效或旋律规范。","use_cases":["品牌","声音"],"tags":["声音","听觉","识别"],"status":"published","version":"V1.0"},
  {"term_uid":"","zh_term":"黑稿标志","en_term":"Black-only Logo","volume_code":"V22","category":"标志与字标 / 黑稿标","definition_long":"黑稿标志是仅用纯黑100%呈现的标志版本，用于黑白印刷、传真与同色背景叠加，是VI中最简适配最广的底线版本。","visual_effect":"纯黑100%、黑白印刷、最简底线。","prompt_usage":"用于纯黑可传真黑白印刷同色叠黑稿标志底线版本。","use_cases":["标志","黑稿"],"tags":["黑稿","纯黑","底线"],"status":"published","version":"V1.0"}
]